<?xml version="1.0" encoding="UTF-8"?>
<xs:schema xmlns:xs="http://www.w3.org/2001/XMLSchema">

  <xs:element name="DataWareHouse">
    <xs:complexType>
      <xs:sequence>

        <xs:element name="DimensionTablesList">
          <xs:complexType>
            <xs:sequence>
              <xs:element name="DimensionTable" maxOccurs="unbounded">
                <xs:complexType>
                  <xs:sequence>
                    <xs:element name="DAttr" maxOccurs="unbounded">
                      <xs:complexType>
                        <xs:attribute name="name" type="xs:string" use="required"/>
                        <xs:attribute name="type" type="xs:string" use="required"/>
                      </xs:complexType>
                    </xs:element>
                  </xs:sequence>
                  <xs:attribute name="Name" type="xs:string"/>
                </xs:complexType>
              </xs:element>
            </xs:sequence>
          </xs:complexType>
        </xs:element>

        <xs:element name="LatticeDimensionList">
          <xs:complexType>
            <xs:sequence>
              <xs:element name="LatticeDimension" maxOccurs="unbounded">
                <xs:complexType>
                  <xs:simpleContent>
                    <xs:extension base="xs:string">
                      <xs:attribute name="type" type="xs:string" use="required"/>
                    </xs:extension>
                  </xs:simpleContent>
                </xs:complexType>
              </xs:element>
            </xs:sequence>
          </xs:complexType>
        </xs:element>

        <xs:element name="CuboidAggregations">
          <xs:complexType>
            <xs:sequence>
              <xs:element name="FactAggregation" maxOccurs="unbounded">
                <xs:complexType>
                  <xs:sequence>
                    <xs:element name="Aggregation" type="xs:string"/>
                  </xs:sequence>
                  <xs:attribute name="column" type="xs:string" use="required"/>
                </xs:complexType>
              </xs:element>
            </xs:sequence>
          </xs:complexType>
        </xs:element>

        <xs:element name="FactTable" maxOccurs="1">
          <xs:complexType>
            <xs:sequence>
              <xs:element name="FKeys">
                <xs:complexType>
                  <xs:sequence>
                    <xs:element name="FAttr" maxOccurs="unbounded">
                      <xs:complexType>
                        <xs:attribute name="name" type="xs:string" use="required"/>
                        <xs:attribute name="type" type="xs:string" use="required"/>
                      </xs:complexType>
                    </xs:element>
                  </xs:sequence>
                </xs:complexType>
              </xs:element>
              <xs:element name="FactVariablesList">
                <xs:complexType>
                  <xs:sequence>
                    <xs:element name="FAttr" maxOccurs="unbounded">
                      <xs:complexType>
                        <xs:attribute name="name" type="xs:string" use="required"/>
                        <xs:attribute name="type" type="xs:string" use="required"/>
                      </xs:complexType>
                    </xs:element>
                  </xs:sequence>
                </xs:complexType>
              </xs:element>
            </xs:sequence>
            <xs:attribute name="Name" type="xs:string"/>
          </xs:complexType>
        </xs:element>

      </xs:sequence>
      <xs:attribute name="Name" type="xs:string"/>
    </xs:complexType>
  </xs:element>

</xs:schema>
